{
  "schema_version": "1.0.0",
  "source_path": "data/dossier/card-rationale-relationships.source.json",
  "source_sha256": "5ba22e4395c3c8c9c0fdaea5a154451f5dcd201ae3f53c8b2472d46eb6545e67",
  "generated_policy": "APPROVED_PUBLIC only; no fallback or inferred relationship",
  "records": [
    {
      "relationship_id": "cardrel_wu_c46718dc",
      "identity_key": "WU",
      "card": {
        "name": "Isperia, Supreme Judge",
        "oracle_id": "c46718dc-24dc-4b77-b455-aa4c89570b8d",
        "scryfall_id": "1e3b82a7-ebef-4190-9f50-40b992ba89c9",
        "data_locator": "data/scryfall/indexes/commander-index.json#oracle_id=c46718dc-24dc-4b77-b455-aa4c89570b8d"
      },
      "rationale": "Isperia represents Azorius leadership, and her card rewards you with additional information when opponents attack you or your planeswalkers.",
      "tags": [
        "Control",
        "Card Draw",
        "Pillowfort"
      ],
      "relationship_class": "NATIVE_IDENTITY_ANCHOR",
      "display_priority": 1,
      "provenance": {
        "claim_ids": [
          "azorius_senate_claim_005"
        ],
        "source_ids": [
          "src_wotc_flavorful_guide_ravnica_allegiance_2019",
          "src_mtg_stories_the_gathering_storm_chapter_3_c2a81b82",
          "src_mtg_stories_rallying_the_reluctant_d21b8009",
          "src_mtg_stories_ashes_6ede4fea",
          "src_mtg_stories_desperate_operatives_6c6a580b",
          "src_mtg_stories_fblthp_e26059d7"
        ],
        "relationship_evidence_locator": "data/raw-factions/azorius_senate/azorius_senate.profile.json#/commander_compass/native_fit_commanders/0"
      }
    },
    {
      "relationship_id": "cardrel_wu_1f8d4d5f",
      "identity_key": "WU",
      "card": {
        "name": "Grand Arbiter Augustin IV",
        "oracle_id": "1f8d4d5f-e82f-45f3-823e-1bb6b536eb18",
        "scryfall_id": "f43748ea-1d65-4ee8-9c66-221412a284c0",
        "data_locator": "data/scryfall/indexes/commander-index.json#oracle_id=1f8d4d5f-e82f-45f3-823e-1bb6b536eb18"
      },
      "rationale": "The ultimate expression of Azorius tax-based gameplay; he slows the game down to a crawl.",
      "tags": [
        "Stax",
        "Taxing",
        "Control"
      ],
      "relationship_class": "NATIVE_IDENTITY_ANCHOR",
      "display_priority": 3,
      "provenance": {
        "claim_ids": [
          "azorius_senate_claim_001",
          "azorius_senate_claim_002",
          "azorius_senate_claim_006",
          "azorius_senate_claim_007"
        ],
        "source_ids": [
          "src_wotc_flavorful_guide_ravnica_allegiance_2019",
          "src_wotc_ravnica_allegiance_mechanics_2018"
        ],
        "relationship_evidence_locator": "data/raw-factions/azorius_senate/azorius_senate.profile.json#/commander_compass/advanced_complexity_commanders/0"
      }
    },
    {
      "relationship_id": "cardrel_ub_8027a610",
      "identity_key": "UB",
      "card": {
        "name": "Lazav, Dimir Mastermind",
        "oracle_id": "8027a610-613e-4640-9840-c8778694f312",
        "scryfall_id": "003dc436-a3af-4e65-b4f8-387155fbcb85",
        "data_locator": "data/scryfall/indexes/commander-index.json#oracle_id=8027a610-613e-4640-9840-c8778694f312"
      },
      "rationale": "Lazav appears because the certified House Dimir record identifies him as the guildmaster of the guild associated with secrecy, spies, assassins, and backroom deals.",
      "tags": [
        "Clones",
        "Hidden information",
        "Graveyard interaction"
      ],
      "relationship_class": "NATIVE_IDENTITY_ANCHOR",
      "display_priority": 1,
      "provenance": {
        "claim_ids": [
          "house_dimir_claim_001",
          "house_dimir_claim_002",
          "house_dimir_claim_004",
          "house_dimir_claim_0017"
        ],
        "source_ids": [
          "src_wotc_flavorful_guide_guilds_ravnica_2018",
          "src_wotc_guilds_ravnica_mechanics_2018"
        ],
        "relationship_evidence_locator": "data/raw-factions/house_dimir/house_dimir.profile.json#/commander_compass/native_fit_commanders/0"
      }
    },
    {
      "relationship_id": "cardrel_br_143a269a",
      "identity_key": "BR",
      "card": {
        "name": "Rakdos, Lord of Riots",
        "oracle_id": "143a269a-b9ee-48ba-bd7b-4aa46eb36778",
        "scryfall_id": "3d0d5a41-8251-437c-a4a0-3b712281ebb0",
        "data_locator": "data/scryfall/indexes/commander-index.json#oracle_id=143a269a-b9ee-48ba-bd7b-4aa46eb36778"
      },
      "rationale": "Rakdos is the native demon-headliner choice: opponents must lose life before the show begins, then life-loss discounts enormous creatures.",
      "tags": [
        "Demons",
        "Big Mana",
        "Damage Gate"
      ],
      "relationship_class": "NATIVE_IDENTITY_ANCHOR",
      "display_priority": 1,
      "provenance": {
        "claim_ids": [
          "cult_of_rakdos_claim_001",
          "cult_of_rakdos_claim_002",
          "cult_of_rakdos_claim_003",
          "cult_of_rakdos_claim_004",
          "cult_of_rakdos_claim_005",
          "cult_of_rakdos_claim_006"
        ],
        "source_ids": [
          "src_wotc_flavorful_guide_ravnica_allegiance_2019",
          "src_wotc_ravnica_allegiance_mechanics_2018"
        ],
        "relationship_evidence_locator": "data/raw-factions/cult_of_rakdos/cult_of_rakdos.profile.json#/commander_compass/native_fit_commanders/0"
      }
    },
    {
      "relationship_id": "cardrel_br_03a4b997",
      "identity_key": "BR",
      "card": {
        "name": "Rakdos, the Showstopper",
        "oracle_id": "03a4b997-4738-41a9-933f-e1f765e3a75a",
        "scryfall_id": "210d07ab-7608-4fda-adb6-562cf194192f",
        "data_locator": "data/scryfall/indexes/commander-index.json#oracle_id=03a4b997-4738-41a9-933f-e1f765e3a75a"
      },
      "rationale": "This is a pure flavor-forward Rakdos performance: the demon arrives, the stage erupts, and survival becomes a coin-flip spectacle.",
      "tags": [
        "Demons",
        "volatility",
        "Board Wipe"
      ],
      "relationship_class": "NATIVE_IDENTITY_ANCHOR",
      "display_priority": 6,
      "provenance": {
        "claim_ids": [
          "cult_of_rakdos_claim_001",
          "cult_of_rakdos_claim_002",
          "cult_of_rakdos_claim_003",
          "cult_of_rakdos_claim_004",
          "cult_of_rakdos_claim_005",
          "cult_of_rakdos_claim_006"
        ],
        "source_ids": [
          "src_wotc_flavorful_guide_ravnica_allegiance_2019",
          "src_wotc_ravnica_allegiance_mechanics_2018"
        ],
        "relationship_evidence_locator": "data/raw-factions/cult_of_rakdos/cult_of_rakdos.profile.json#/commander_compass/iconic_lore_forward_commanders/0"
      }
    },
    {
      "relationship_id": "cardrel_rg_b7505737",
      "identity_key": "RG",
      "card": {
        "name": "Borborygmos Enraged",
        "oracle_id": "b7505737-1fc8-4ee8-8b1d-5dde73b6a76d",
        "scryfall_id": "02df18c5-07b9-4e85-9c4b-58b63fa59437",
        "data_locator": "data/scryfall/indexes/commander-index.json#oracle_id=b7505737-1fc8-4ee8-8b1d-5dde73b6a76d"
      },
      "rationale": "Borborygmos appears because the certified Gruul record identifies him as the leader of the Burning-Tree clan.",
      "tags": [
        "Lands",
        "Discard",
        "Large-Creature Pressure"
      ],
      "relationship_class": "NATIVE_IDENTITY_ANCHOR",
      "display_priority": 1,
      "provenance": {
        "claim_ids": [
          "claim_gruul_clans_key_figure_0012",
          "claim_gruul_clans_key_figure_0013",
          "claim_gruul_clans_key_figure_0035",
          "claim_gruul_clans_key_figure_0036",
          "claim_gruul_clans_key_figure_0046"
        ],
        "source_ids": [
          "src_gruul_clans_0002",
          "src_gruul_clans_0003",
          "src_gruul_clans_0009"
        ],
        "relationship_evidence_locator": "data/raw-factions/gruul_clans/gruul_clans.profile.json#/commander_compass/native_fit_commanders/0"
      }
    },
    {
      "relationship_id": "cardrel_rg_ebf3fd80",
      "identity_key": "RG",
      "card": {
        "name": "Nikya of the Old Ways",
        "oracle_id": "ebf3fd80-9574-489b-9428-f4251834bdc4",
        "scryfall_id": "0dcdad71-323e-41e0-a1b3-9fd5b753e71c",
        "data_locator": "data/scryfall/indexes/commander-index.json#oracle_id=ebf3fd80-9574-489b-9428-f4251834bdc4"
      },
      "rationale": "She forces you to abandon 'civilized' noncreature spells in exchange for massive mana for monsters.",
      "tags": [
        "Creatures Only",
        "Big Mana"
      ],
      "relationship_class": "NATIVE_IDENTITY_ANCHOR",
      "display_priority": 3,
      "provenance": {
        "claim_ids": [
          "claim_gruul_clans_key_figure_0023",
          "claim_gruul_clans_structure_0021",
          "claim_gruul_clans_philosophy_0022"
        ],
        "source_ids": [
          "src_gruul_clans_0002"
        ],
        "relationship_evidence_locator": "data/raw-factions/gruul_clans/gruul_clans.profile.json#/commander_compass/budget_friendly_commanders/0"
      }
    },
    {
      "relationship_id": "cardrel_rg_6ed13a89",
      "identity_key": "RG",
      "card": {
        "name": "Ruric Thar, the Unbowed",
        "oracle_id": "6ed13a89-4284-4c01-8099-75e2d68c8c63",
        "scryfall_id": "aa828bdc-221e-4e81-9e71-6f288690ddcd",
        "data_locator": "data/scryfall/indexes/commander-index.json#oracle_id=6ed13a89-4284-4c01-8099-75e2d68c8c63"
      },
      "rationale": "A severe Gruul pressure piece against noncreature spell plans; creature-first tables punish players who try to solve everything with spells.",
      "tags": [
        "Hatebears",
        "Punisher",
        "Creature Pressure"
      ],
      "relationship_class": "NATIVE_IDENTITY_ANCHOR",
      "display_priority": 4,
      "provenance": {
        "claim_ids": [
          "claim_gruul_clans_key_figure_0016",
          "claim_gruul_clans_structure_0017"
        ],
        "source_ids": [